<?xml version="1.0"?>
<!-- Examples based on xNL V2.0 DTD -->
<!DOCTYPE xNL SYSTEM "xNL.dtd">
<xNL> 
  <NameDetails  PartyType="Person">
    <PersonName>
       <Title>Mr</Title> 
       <FirstName Type="GivenName">Ram</FirstName> 
       <MiddleName>Laxhman</MiddleName>
       <MiddleName Type="Initial">B</MiddleName>
       <LastName NameType="SurName">Kumar</LastName> 
       <Alias>Ram</Alias>
       <FormerName>
       	<NameLine>Ramkumar</NameLine>
       </FormerName>
    </PersonName>
    <DependencyName PartyType="Person"
    				DependencyType="C/O">   
      <PersonName>
         <Title>Mr</Title> 
         <FirstName Type="Official"
         			NameType="GivenName">
                    Venkat</FirstName>
         <FirstName Type="Unofficial"
         			NameType="GivenName"> 
                    Venki</FirstName>
         <LastName>Krishnan</LastName> 
      </PersonName> 
    </DependencyName>    
  </NameDetails>
  
  <NameDetails PartyType="Person">
    <PersonName>
       <Title>Mrs</Title> 
       <FirstName>S</FirstName>
       <MiddleName>Devi</MiddleName> 
       <LastName>Sadasivan</LastName> 
       <Alias>Baby</Alias>
    </PersonName>
    <DependencyName PartyType="Organisation">   
      <OrganisationNameDetails> 
      	<OrganisationName NameType="New Name">NRMA ASSET MANAGEMENT</OrganisationName>
      	<OrganisationName NameType="Formerly">NRMA INVESTMENTS</OrganisationName> 
      </OrganisationNameDetails>
    </DependencyName>    
  </NameDetails>  
  
  <NameDetails PartyType="Person">
    <NameLine>Ram Kumar</NameLine>
     <DependencyName PartyType="Organisation">
     	<NameLine>C/O MasterSoft International Pty. Ltd</NameLine>
     </DependencyName>
  </NameDetails>
 </xNL>
